{
  "schema_version": 1,
  "record_kind": "framework_fixture",
  "candidate": {
    "id": "fixture-contract-v1",
    "authorization_class": "fixture",
    "route_id": "R-GENERIC-BASELINE",
    "hypothesis_id": null,
    "implementation": "deterministic fixture",
    "code_commit": "0000000000000000000000000000000000000000",
    "entrypoint": "fixture-only"
  },
  "target": {
    "curve_id": "toy-f17-a0-b7",
    "threat_model": "classical-single-target-plain",
    "field_p": 17,
    "curve_a": 0,
    "curve_b": 7,
    "base_point": [
      1,
      5
    ],
    "target_point": [
      12,
      16
    ],
    "base_order": 9,
    "target_count": 1,
    "auxiliary_inputs": [],
    "scalar_interval": null
  },
  "result": {
    "claimed_scalar": 5
  },
  "cost": {
    "online": {
      "wall_time_seconds": 0.001,
      "group_operations": 4,
      "field_operations": 20,
      "peak_memory_bytes": 1024
    },
    "offline": {
      "wall_time_seconds": 0.0,
      "group_operations": 0,
      "field_operations": 0,
      "peak_memory_bytes": 0
    },
    "reusable_precomputation": false,
    "amortization_target_count": 1,
    "parallel_workers": 1,
    "success_probability": 1.0
  },
  "environment": {
    "python": "3.x fixture",
    "platform": "deterministic-fixture",
    "tool_versions": {}
  },
  "provenance": {
    "seed": 0,
    "command": [
      "fixture-only"
    ],
    "dirty_worktree": false,
    "input_sha256": "a03ebd2c7299cb35d2ed782b7609617a8666a3b8c7981af96b37c88053027893",
    "output_sha256": "c9044a41b814af92095f23d48f0fcfdf3d1d00ee8d082ad26e58a8bfdb439fde",
    "environment_sha256": "d2673f75e64254a126454f07eeec2c53480de46275a9ce5dfcc8659cf55892e8",
    "record_sha256": "091a87e3aff03d846929b80a7d40646ea735fdb4ed1c893d48ff92ba20f3fcba"
  },
  "validation": {
    "validator_id": "framework.ec_oracle.v1",
    "independent_implementation": true,
    "shares_decisive_logic": false,
    "passed": true,
    "validator_output_sha256": "c9910dca2603915d740733f6d5863b38f0e33367410b84e9ef3212daa98cb427"
  },
  "claims": {
    "success_level": "scope-only",
    "asymptotic_claim": null,
    "secp256k1_break": false,
    "disclosure_gate_acknowledged": false
  }
}
